{
  "root": {
    "type": "card",
    "id": "eval_card_45",
    "title": "Evaluation: Neural network training loss curves monitor",
    "subtitle": "Prompt #45 validation",
    "text": "This interface verifies successful rendering for: \"Neural network training loss curves monitor\"",
    "annotations": {
      "confidence": {
        "value": "99%"
      },
      "freshness": {
        "value": "1s"
      }
    }
  },
  "data": {},
  "links": [],
  "params": {}
}