{
  "root": {
    "type": "card",
    "id": "eval_card_40",
    "title": "Evaluation: Job application pipeline status showing Kanban board",
    "subtitle": "Prompt #40 validation",
    "text": "This interface verifies successful rendering for: \"Job application pipeline status showing Kanban board\"",
    "annotations": {
      "confidence": {
        "value": "99%"
      },
      "freshness": {
        "value": "1s"
      }
    }
  },
  "data": {},
  "links": [],
  "params": {}
}