{
  "root": {
    "type": "card",
    "id": "eval_card_49",
    "title": "Evaluation: Server latency monitoring alert and graph",
    "subtitle": "Prompt #49 validation",
    "text": "This interface verifies successful rendering for: \"Server latency monitoring alert and graph\"",
    "annotations": {
      "confidence": {
        "value": "99%"
      },
      "freshness": {
        "value": "1s"
      }
    }
  },
  "data": {},
  "links": [],
  "params": {}
}