{
  "root": {
    "type": "card",
    "id": "eval_card_36",
    "title": "Evaluation: Inventory status alerts and reordering status",
    "subtitle": "Prompt #36 validation",
    "text": "This interface verifies successful rendering for: \"Inventory status alerts and reordering status\"",
    "annotations": {
      "confidence": {
        "value": "99%"
      },
      "freshness": {
        "value": "1s"
      }
    }
  },
  "data": {},
  "links": [],
  "params": {}
}