{
  "root": {
    "type": "card",
    "id": "eval_card_34",
    "title": "Evaluation: Visa application schedule and documentation progress",
    "subtitle": "Prompt #34 validation",
    "text": "This interface verifies successful rendering for: \"Visa application schedule and documentation progress\"",
    "annotations": {
      "confidence": {
        "value": "99%"
      },
      "freshness": {
        "value": "1s"
      }
    }
  },
  "data": {},
  "links": [],
  "params": {}
}