{
  "root": {
    "type": "card",
    "id": "eval_card_25",
    "title": "Evaluation: Analyze security upgrade advisory and lockfile diff",
    "subtitle": "Prompt #25 validation",
    "text": "This interface verifies successful rendering for: \"Analyze security upgrade advisory and lockfile diff\"",
    "annotations": {
      "confidence": {
        "value": "99%"
      },
      "freshness": {
        "value": "1s"
      }
    }
  },
  "data": {},
  "links": [],
  "params": {}
}