{
  "root": {
    "type": "card",
    "id": "eval_card_11",
    "title": "Evaluation: Extract structured fields from PDF invoice",
    "subtitle": "Prompt #11 validation",
    "text": "This interface verifies successful rendering for: \"Extract structured fields from PDF invoice\"",
    "annotations": {
      "confidence": {
        "value": "99%"
      },
      "freshness": {
        "value": "1s"
      }
    }
  },
  "data": {},
  "links": [],
  "params": {}
}