{
  "root": {
    "type": "card",
    "id": "eval_card_15",
    "title": "Evaluation: Lab report showing blood test cholesterol levels",
    "subtitle": "Prompt #15 validation",
    "text": "This interface verifies successful rendering for: \"Lab report showing blood test cholesterol levels\"",
    "annotations": {
      "confidence": {
        "value": "99%"
      },
      "freshness": {
        "value": "1s"
      }
    }
  },
  "data": {},
  "links": [],
  "params": {}
}